{
  "schema_version": "v1.0.0",
  "doc_id": "client_commons:src/lib/utils.ts",
  "repo": {
    "name": "client_commons",
    "source_default_branch": "main"
  },
  "file_name": "utils.ts",
  "source": {
    "file_path": "src/lib/utils.ts",
    "commit_sha": "unknown",
    "generated_at_iso": "2026-02-12T08:33:39.926Z",
    "language": "ts",
    "framework_tags": [
      "node",
      "typescript"
    ],
    "link_to_github": "https://github.com/akeylesspro/akeyless-client-commons/blob/unknown/src/lib/utils.ts",
    "link_to_nx_kb": "/repos/client_commons/files/src/lib/utils.ts"
  },
  "summary": {
    "purpose": "Documentation for src/lib/utils.ts.",
    "problem_solved": "Describes how this file contributes to its repository module architecture."
  },
  "dependencies": {
    "external": [
      {
        "name": "clsx",
        "kind": "runtime",
        "why_used": "Imported package used by this module."
      },
      {
        "name": "tailwind-merge",
        "kind": "runtime",
        "why_used": "Imported package used by this module."
      }
    ],
    "internal": []
  },
  "exports": [
    {
      "name": "cn",
      "kind": "function",
      "description_one_line": "cn export in this file.",
      "symbol_id": "cn"
    }
  ],
  "symbols": [
    {
      "symbol_id": "cn",
      "name": "cn",
      "kind": "function",
      "description_one_line": "cn export in this file.",
      "details": {
        "what_it_does": "cn is exported from this module and participates in the module's contract."
      },
      "examples": {
        "minimal_correct": {
          "title": "Minimal usage",
          "code": "import { cn } from \"module-path\";"
        },
        "incorrect": {
          "title": "Incorrect usage",
          "code": "import { Missingcn } from \"module-path\";",
          "why_incorrect": "The symbol name does not match the module export."
        }
      },
      "locations": {
        "source_line_start": 4,
        "source_line_end": 4,
        "github_permalink": "https://github.com/akeylesspro/akeyless-client-commons/blob/unknown/src/lib/utils.ts#L4",
        "nx_kb_anchor": "#cn"
      }
    }
  ],
  "quality": {
    "generation_confidence": "medium",
    "known_gaps": [
      "Descriptions are generated heuristically and should be reviewed in PR."
    ]
  }
}
