{
  "schema_version": "v1.0.0",
  "doc_id": "client_commons:src/env.d.ts",
  "repo": {
    "name": "client_commons",
    "source_default_branch": "main"
  },
  "file_name": "env.d.ts",
  "source": {
    "file_path": "src/env.d.ts",
    "commit_sha": "unknown",
    "generated_at_iso": "2026-02-12T08:33:39.864Z",
    "language": "ts",
    "framework_tags": [
      "node",
      "typescript"
    ],
    "link_to_github": "https://github.com/akeylesspro/akeyless-client-commons/blob/unknown/src/env.d.ts",
    "link_to_nx_kb": "/repos/client_commons/files/src/env.d.ts"
  },
  "summary": {
    "purpose": "Documentation for src/env.d.ts.",
    "problem_solved": "Describes how this file contributes to its repository module architecture."
  },
  "dependencies": {
    "external": [],
    "internal": []
  },
  "exports": [],
  "symbols": [],
  "quality": {
    "generation_confidence": "medium",
    "known_gaps": [
      "Descriptions are generated heuristically and should be reviewed in PR."
    ]
  }
}
