{
  "schema_version": "v1.0.0",
  "doc_id": "client_commons:src/components/ui/SearchSelect.tsx",
  "repo": {
    "name": "client_commons",
    "source_default_branch": "main"
  },
  "file_name": "SearchSelect.tsx",
  "source": {
    "file_path": "src/components/ui/SearchSelect.tsx",
    "commit_sha": "unknown",
    "generated_at_iso": "2026-02-12T08:33:39.845Z",
    "language": "tsx",
    "framework_tags": [
      "node",
      "typescript"
    ],
    "link_to_github": "https://github.com/akeylesspro/akeyless-client-commons/blob/unknown/src/components/ui/SearchSelect.tsx",
    "link_to_nx_kb": "/repos/client_commons/files/src/components/ui/SearchSelect.tsx"
  },
  "summary": {
    "purpose": "Documentation for src/components/ui/SearchSelect.tsx.",
    "problem_solved": "Describes how this file contributes to its repository module architecture."
  },
  "dependencies": {
    "external": [
      {
        "name": "@/lib/utils",
        "kind": "runtime",
        "why_used": "Imported package used by this module."
      },
      {
        "name": "@/components/ui/button",
        "kind": "runtime",
        "why_used": "Imported package used by this module."
      },
      {
        "name": "@/components/ui/command",
        "kind": "runtime",
        "why_used": "Imported package used by this module."
      },
      {
        "name": "@/components/ui/popover",
        "kind": "runtime",
        "why_used": "Imported package used by this module."
      },
      {
        "name": "lucide-react",
        "kind": "runtime",
        "why_used": "Imported package used by this module."
      },
      {
        "name": "react",
        "kind": "runtime",
        "why_used": "Imported package used by this module."
      },
      {
        "name": "src/types",
        "kind": "runtime",
        "why_used": "Imported package used by this module."
      }
    ],
    "internal": []
  },
  "exports": [
    {
      "name": "SearchSelectOptions",
      "kind": "interface",
      "description_one_line": "SearchSelectOptions export in this file.",
      "symbol_id": "SearchSelectOptions"
    },
    {
      "name": "SearchSelectProps",
      "kind": "interface",
      "description_one_line": "SearchSelectProps export in this file.",
      "symbol_id": "SearchSelectProps"
    }
  ],
  "symbols": [
    {
      "symbol_id": "SearchSelectOptions",
      "name": "SearchSelectOptions",
      "kind": "interface",
      "description_one_line": "SearchSelectOptions export in this file.",
      "details": {
        "what_it_does": "SearchSelectOptions is exported from this module and participates in the module's contract."
      },
      "examples": {
        "minimal_correct": {
          "title": "Minimal usage",
          "code": "import { SearchSelectOptions } from \"module-path\";"
        },
        "incorrect": {
          "title": "Incorrect usage",
          "code": "import { MissingSearchSelectOptions } from \"module-path\";",
          "why_incorrect": "The symbol name does not match the module export."
        }
      },
      "locations": {
        "source_line_start": 10,
        "source_line_end": 10,
        "github_permalink": "https://github.com/akeylesspro/akeyless-client-commons/blob/unknown/src/components/ui/SearchSelect.tsx#L10",
        "nx_kb_anchor": "#SearchSelectOptions"
      }
    },
    {
      "symbol_id": "SearchSelectProps",
      "name": "SearchSelectProps",
      "kind": "interface",
      "description_one_line": "SearchSelectProps export in this file.",
      "details": {
        "what_it_does": "SearchSelectProps is exported from this module and participates in the module's contract."
      },
      "examples": {
        "minimal_correct": {
          "title": "Minimal usage",
          "code": "import { SearchSelectProps } from \"module-path\";"
        },
        "incorrect": {
          "title": "Incorrect usage",
          "code": "import { MissingSearchSelectProps } from \"module-path\";",
          "why_incorrect": "The symbol name does not match the module export."
        }
      },
      "locations": {
        "source_line_start": 14,
        "source_line_end": 14,
        "github_permalink": "https://github.com/akeylesspro/akeyless-client-commons/blob/unknown/src/components/ui/SearchSelect.tsx#L14",
        "nx_kb_anchor": "#SearchSelectProps"
      }
    }
  ],
  "quality": {
    "generation_confidence": "medium",
    "known_gaps": [
      "Descriptions are generated heuristically and should be reviewed in PR."
    ]
  }
}
