{
  "schema_version": "v1.0.0",
  "doc_id": "client_commons:src/components/CodeInput.tsx",
  "repo": {
    "name": "client_commons",
    "source_default_branch": "main"
  },
  "file_name": "CodeInput.tsx",
  "source": {
    "file_path": "src/components/CodeInput.tsx",
    "commit_sha": "unknown",
    "generated_at_iso": "2026-02-12T08:33:39.749Z",
    "language": "tsx",
    "framework_tags": [
      "node",
      "typescript"
    ],
    "link_to_github": "https://github.com/akeylesspro/akeyless-client-commons/blob/unknown/src/components/CodeInput.tsx",
    "link_to_nx_kb": "/repos/client_commons/files/src/components/CodeInput.tsx"
  },
  "summary": {
    "purpose": "Documentation for src/components/CodeInput.tsx.",
    "problem_solved": "Describes how this file contributes to its repository module architecture."
  },
  "dependencies": {
    "external": [
      {
        "name": "@/lib/utils",
        "kind": "runtime",
        "why_used": "Imported package used by this module."
      },
      {
        "name": "input-otp",
        "kind": "runtime",
        "why_used": "Imported package used by this module."
      },
      {
        "name": "react",
        "kind": "runtime",
        "why_used": "Imported package used by this module."
      },
      {
        "name": "src/types",
        "kind": "runtime",
        "why_used": "Imported package used by this module."
      }
    ],
    "internal": []
  },
  "exports": [],
  "symbols": [],
  "quality": {
    "generation_confidence": "medium",
    "known_gaps": [
      "Descriptions are generated heuristically and should be reviewed in PR."
    ]
  }
}
