{
  "schema_version": "v1.0.0",
  "doc_id": "client_commons:src/components/index.tsx",
  "repo": {
    "name": "client_commons",
    "source_default_branch": "main"
  },
  "file_name": "index.tsx",
  "source": {
    "file_path": "src/components/index.tsx",
    "commit_sha": "unknown",
    "generated_at_iso": "2026-02-12T08:33:39.775Z",
    "language": "tsx",
    "framework_tags": [
      "node",
      "typescript"
    ],
    "link_to_github": "https://github.com/akeylesspro/akeyless-client-commons/blob/unknown/src/components/index.tsx",
    "link_to_nx_kb": "/repos/client_commons/files/src/components/index.tsx"
  },
  "summary": {
    "purpose": "Documentation for src/components/index.tsx.",
    "problem_solved": "Describes how this file contributes to its repository module architecture."
  },
  "dependencies": {
    "external": [],
    "internal": [
      {
        "import_path": "./utils",
        "resolved_file_path": "src/components/utils",
        "why_used": "Imported from a local module to compose this file.",
        "link_to_nx_kb": "/repos/client_commons/files/src/components/utils",
        "link_to_github": "https://github.com/akeylesspro/akeyless-client-commons/blob/unknown/src/components/utils"
      }
    ]
  },
  "exports": [],
  "symbols": [],
  "quality": {
    "generation_confidence": "medium",
    "known_gaps": [
      "Descriptions are generated heuristically and should be reviewed in PR."
    ]
  }
}
