{
  "schema_version": "v1.0.0",
  "doc_id": "server_commons:src/index.ts",
  "repo": {
    "name": "server_commons",
    "source_default_branch": "main"
  },
  "file_name": "index.ts",
  "source": {
    "file_path": "src/index.ts",
    "commit_sha": "unknown",
    "generated_at_iso": "2026-02-12T08:33:39.985Z",
    "language": "ts",
    "framework_tags": [
      "node",
      "typescript"
    ],
    "link_to_github": "https://github.com/akeylesspro/akeyless-server-commons/blob/unknown/src/index.ts",
    "link_to_nx_kb": "/repos/server_commons/files/src/index.ts"
  },
  "summary": {
    "purpose": "Documentation for src/index.ts.",
    "problem_solved": "Describes how this file contributes to its repository module architecture."
  },
  "dependencies": {
    "external": [],
    "internal": [
      {
        "import_path": "./helpers",
        "resolved_file_path": "src/helpers",
        "why_used": "Imported from a local module to compose this file.",
        "link_to_nx_kb": "/repos/server_commons/files/src/helpers",
        "link_to_github": "https://github.com/akeylesspro/akeyless-server-commons/blob/unknown/src/helpers"
      },
      {
        "import_path": "./managers",
        "resolved_file_path": "src/managers",
        "why_used": "Imported from a local module to compose this file.",
        "link_to_nx_kb": "/repos/server_commons/files/src/managers",
        "link_to_github": "https://github.com/akeylesspro/akeyless-server-commons/blob/unknown/src/managers"
      },
      {
        "import_path": "./middlewares",
        "resolved_file_path": "src/middlewares",
        "why_used": "Imported from a local module to compose this file.",
        "link_to_nx_kb": "/repos/server_commons/files/src/middlewares",
        "link_to_github": "https://github.com/akeylesspro/akeyless-server-commons/blob/unknown/src/middlewares"
      },
      {
        "import_path": "./types",
        "resolved_file_path": "src/types",
        "why_used": "Imported from a local module to compose this file.",
        "link_to_nx_kb": "/repos/server_commons/files/src/types",
        "link_to_github": "https://github.com/akeylesspro/akeyless-server-commons/blob/unknown/src/types"
      }
    ]
  },
  "exports": [],
  "symbols": [],
  "quality": {
    "generation_confidence": "medium",
    "known_gaps": [
      "Descriptions are generated heuristically and should be reviewed in PR."
    ]
  }
}
